{
  "schema_version": "record-v2-acquisition",
  "provenance": "recorded_experimental",
  "evolution_provenance": "native_analog_evolution",
  "preregistration_sha256": "a14e792fe5542f77d58911e5fd6ddca9594f607af7dd8973bd851495547287bd",
  "device": {
    "vendor": "fixture-vendor",
    "device_id": "fixture-device-2"
  },
  "operator": {
    "name": "fixture operator",
    "organization": "fixture org",
    "organizationally_external": false
  },
  "acquisition_randomization_seed": "fixture-seed-20260808b",
  "channels": [
    {
      "channel_id": "ch-B",
      "source_id": "n2",
      "target_id": "n3",
      "probe_sign": "plus",
      "epsilon": 0.1,
      "evolution_time": 0.5,
      "evolution_family_id": "F1",
      "job_id": "job-0003",
      "program_hash": "bd72bde1538b9744cd3313fefcf3a0501975a82344ce38cecc4676b9ffab3e9e",
      "compiler_or_pulse_version": "fixture-pulse 2.1",
      "calibration_snapshot_hash": "ffa39c51e023cc19f15cbb11b0aff56b7bd8f7c976cddd6758f949c82e2699e2",
      "used_in_calibration": true,
      "raw_artifact_sha256": "8667f204c35506254ce5ae8e35e2e7473ab5f55b256e424fed29d65c8d1b1090",
      "data": {
        "kind": "timestamped_batches",
        "batches": [
          { "batch_id": "b1", "started_at": "2026-08-08T02:00:00Z", "ended_at": "2026-08-08T02:01:00Z", "n_shots": 50, "n_ones": 12 },
          { "batch_id": "b2", "started_at": "2026-08-08T02:05:00Z", "ended_at": "2026-08-08T02:06:00Z", "n_shots": 50, "n_ones": 13 },
          { "batch_id": "b3", "started_at": "2026-08-08T02:10:00Z", "ended_at": "2026-08-08T02:11:00Z", "n_shots": 50, "n_ones": 11 },
          { "batch_id": "b4", "started_at": "2026-08-08T02:15:00Z", "ended_at": "2026-08-08T02:16:00Z", "n_shots": 50, "n_ones": 14 }
        ]
      }
    }
  ],
  "results_including_failures_public": true
}
